[
  {
    "id": "E4-01",
    "codigo": "E4-01",
    "titulo": "Suprimento (Classes I, III e V) às OMDS da Bda",
    "area": "Suprimento",
    "classes": [
      "I",
      "III",
      "V"
    ],
    "objetivo": "Garantir o abastecimento contínuo das OMDS da Bda nas Classes I (víveres), III (combustível/lubrificantes) e V (munição), conforme os níveis de suprimento estabelecidos.",
    "etapas": [
      "Levantar as necessidades de suprimento junto às OMDS",
      "Consolidar o pedido de suprimento da Bda",
      "Encaminhar o pedido ao Batalhão Logístico (B Log)",
      "Receber e conferir o material entregue pelo B Log",
      "Distribuir o material às OMDS solicitantes",
      "Atualizar a escrituração e os níveis de estoque"
    ],
    "responsaveis": [
      "E/4 (gestão)",
      "OMDS da Bda (levantamento)",
      "B Log (provedor)"
    ],
    "riscos": [
      {
        "descricao": "Recebimento de material fora de especificação ou danificado",
        "causa": "Falha na conferência no recebimento",
        "consequencia": "Material inutilizável chega às OMDS",
        "probabilidade": 2,
        "impacto": 3,
        "controle": "Checklist de conferência obrigatório no recebimento"
      }
    ],
    "fontes": [
      "R-1 (RISG) art. 34-35",
      "MC 4.0 Log Mil Ter",
      "EB70-MC-10.317"
    ]
  },
  {
    "id": "E4-02",
    "codigo": "E4-02",
    "titulo": "Manutenção de viaturas e armamento (2º escalão)",
    "area": "Manutenção",
    "classes": [
      "IX"
    ],
    "objetivo": "Assegurar que viaturas e armamento estejam em condições de emprego, por meio da manutenção preventiva e corretiva de 2º escalão.",
    "etapas": [
      "Programar inspeções técnicas periódicas do material",
      "Executar a manutenção de 1º escalão nas OMDS",
      "Encaminhar material que exige manutenção de 2º escalão a oficina",
      "Realizar a manutenção de 2º escalão",
      "Registrar os trabalhos executados e atualizar a escrituração",
      "Devolver o material à OMDS de origem"
    ],
    "responsaveis": [
      "E/4 (gestão)",
      "Oficina de manutenção",
      "OMDS da Bda"
    ],
    "riscos": [
      {
        "descricao": "Acidente durante a manutenção",
        "causa": "Uso incorreto de EPI/dispositivos de segurança na oficina",
        "consequencia": "Lesão a militar ou dano a equipamento",
        "probabilidade": 2,
        "impacto": 4,
        "controle": "Fiscalização do uso de EPI; instrução periódica"
      }
    ],
    "fontes": [
      "R-1 (RISG) art. 34-35",
      "MC 4.0 Log Mil Ter",
      "EB70-MC-10.317"
    ]
  },
  {
    "id": "E4-03",
    "codigo": "E4-03",
    "titulo": "Transporte - planejamento e execução de comboio logístico",
    "area": "Transporte",
    "classes": [
      "III"
    ],
    "objetivo": "Planejar e executar o transporte de suprimento, material e pessoal entre a Bda, o B Log e às OMDS, com segurança e no prazo previsto.",
    "etapas": [
      "Levantar a necessidade de transporte (carga, volume, prazo)",
      "Planejar o itinerário e escalar viaturas e motoristas",
      "Verificar as condições de segurança das viaturas antes da saída",
      "Executar o deslocamento/comboio",
      "Conferir a carga na chegada ao destino",
      "Registrar consumo de combustível e ocorrências da viagem"
    ],
    "responsaveis": [
      "E/4",
      "Chefe do comboio",
      "Motoristas escalados"
    ],
    "riscos": [
      {
        "descricao": "Atraso ou acidente no deslocamento do comboio",
        "causa": "Planejamento de itinerário sem levantamento previo",
        "consequencia": "Atraso na entrega ou dano a viatura/carga/pessoal",
        "probabilidade": 2,
        "impacto": 4,
        "controle": "Reconhecimento previo de itinerário; briefing de segurança"
      },
      {
        "descricao": "Extravio ou avaria de carga durante o transporte",
        "causa": "Fixação inadequada da carga na viatura",
        "consequencia": "Perda de material e necessidade de reposicao",
        "probabilidade": 2,
        "impacto": 3,
        "controle": "Checklist de carregamento e amarração da carga"
      }
    ],
    "fontes": [
      "MC 4.0 Log Mil Ter",
      "EB70-MC-10.317",
      "R-1 (RISG) art. 34-35"
    ]
  },
  {
    "id": "E4-04",
    "codigo": "E4-04",
    "titulo": "Saúde (função logística) - suprimento e evacuação",
    "area": "Saúde",
    "classes": [
      "VIII"
    ],
    "objetivo": "Garantir o suprimento de material de saúde (Classe VIII) e a capacidade de evacuação de militares doentes/feridos.",
    "etapas": [
      "Levantar a necessidade de material de saúde junto a FS",
      "Solicitar reposicao do material de Classe VIII",
      "Verificar disponibilidade de viatura/meio de evacuação",
      "Planejar o fluxo de evacuação em atividades de campo/instrução",
      "Registrar consumo e validade dos medicamentos controlados"
    ],
    "responsaveis": [
      "E/4",
      "Farmácia / Formação Sanitária (FS)"
    ],
    "riscos": [
      {
        "descricao": "Medicamento vencido ou fora de especificação em uso",
        "causa": "Falha no controle de validade do estoque",
        "consequencia": "Risco a saúde do militar atendido",
        "probabilidade": 2,
        "impacto": 4,
        "controle": "Controle periódico de validade (FEFO) e registro de descarte"
      }
    ],
    "fontes": [
      "MC 4.0 Log Mil Ter (função Saúde)",
      "Legislação sanitária"
    ]
  },
  {
    "id": "E4-05",
    "codigo": "E4-05",
    "titulo": "Salvamento - recuperacao de material danificado",
    "area": "Salvamento",
    "classes": [
      "IX"
    ],
    "objetivo": "Recuperar o máximo de material danificado (viaturas, armamento, equipamento) e dar a destinação correta ao que não for recuperável.",
    "etapas": [
      "Identificar e classificar o material danificado",
      "Encaminhar o material recuperável a oficina de manutenção",
      "Providenciar a baixa/descarte do material irrecuperável",
      "Registrar o resultado do salvamento e atualizar a escrituração"
    ],
    "responsaveis": [
      "E/4",
      "Equipe de salvamento",
      "Oficina"
    ],
    "riscos": [
      {
        "descricao": "Material recuperável descartado indevidamente",
        "causa": "Classificação incorreta na triagem inicial",
        "consequencia": "Prejuízo patrimonial e reposicao desnecessaria",
        "probabilidade": 2,
        "impacto": 3,
        "controle": "Dupla avaliação técnica antes da decisão de baixa"
      }
    ],
    "fontes": [
      "MC 4.0 Log Mil Ter (função Salvamento)",
      "Legislação patrimonial"
    ]
  },
  {
    "id": "E4-06",
    "codigo": "E4-06",
    "titulo": "Classe III - controle de combustíveis e lubrificantes",
    "area": "Suprimento / Combustível",
    "classes": [
      "III"
    ],
    "objetivo": "Garantir o suprimento e o controle rigoroso do consumo de combustíveis e lubrificantes (Classe III) das viaturas e geradores da Bda.",
    "etapas": [
      "Levantar o consumo mensal previsto por OMDS/viatura",
      "Solicitar a cota de combustível ao órgão provedor",
      "Controlar o abastecimento no posto de abastecimento da OM",
      "Registrar o consumo por viatura (km rodado x litros)",
      "Conferir mensalmente o saldo de cota x consumo real",
      "Reportar desvios de consumo ao Cmt"
    ],
    "responsaveis": [
      "E/4",
      "Fiscal do posto de abastecimento",
      "OMDS da Bda"
    ],
    "riscos": [
      {
        "descricao": "Consumo de combustível acima da cota sem justificativa",
        "causa": "Ausencia de registro sistematico de abastecimento por viatura",
        "consequencia": "Estouro de cota e falta de combustível no fim do período",
        "probabilidade": 3,
        "impacto": 3,
        "controle": "Controle diário de abastecimento por viatura; conferência semanal do saldo de cota"
      },
      {
        "descricao": "Desvio ou uso indevido de combustível",
        "causa": "Fragilidade no controle de saída do posto de abastecimento",
        "consequencia": "Prejuízo patrimonial e responsabilização",
        "probabilidade": 2,
        "impacto": 4,
        "controle": "Registro assinado de cada abastecimento; auditoria periódica"
      }
    ],
    "fontes": [
      "MC 4.0 Log Mil Ter",
      "Plano de Gestão de Riscos - Integridade e Controle OMDS"
    ]
  },
  {
    "id": "E4-07",
    "codigo": "E4-07",
    "titulo": "Controle do calendário de obrigações da Seção de Logística",
    "area": "Gestão / Controle interno",
    "classes": [],
    "objetivo": "Assegurar o cumprimento, dentro do prazo, de todas as obrigações periódicas da 4ª Seção (relatórios, prestações de contas, inventários, mapas, inspeções).",
    "etapas": [
      "Levantar todas as obrigações periódicas do E/4 e suas periodicidades",
      "Consolidar o calendário anual de obrigações",
      "Definir responsável e prazo de antecedência para cada item",
      "Acompanhar mensalmente o cumprimento do calendário",
      "Registrar e justificar eventuais atrasos",
      "Atualizar o calendário conforme novas exigencias do escalão superior"
    ],
    "responsaveis": [
      "E/4",
      "Encarregado do controle interno"
    ],
    "riscos": [
      {
        "descricao": "Não cumprimento de prazo de obrigação periódica",
        "causa": "Ausencia de calendário consolidado e de responsável por item",
        "consequencia": "Cobranca do escalão superior e responsabilização",
        "probabilidade": 3,
        "impacto": 3,
        "controle": "Calendário unico acompanhado mensalmente, com aviso de antecedência (ex.: 10 dias antes do vencimento)"
      },
      {
        "descricao": "Duplicidade ou lacuna entre obrigações de diferentes classes",
        "causa": "Falta de consolidação unica do calendário do E/4",
        "consequencia": "Retrabalho ou item esquecido",
        "probabilidade": 2,
        "impacto": 2,